<?xml version="1.0" encoding="UTF-8"?>
<xs:schema xmlns:xs="http://www.w3.org/2001/XMLSchema">
    <xs:element name="cardata">
        <xs:complexType>
            <xs:sequence>
                <xs:element name="car" maxOccurs="unbounded">
                    <xs:complexType>
                        <xs:sequence>
                            <xs:element name="companyname" type="xs:string"/>
                            <xs:element name="model" type="xs:string"/>
                            <xs:element name="engine" type="xs:string"/>
                            <xs:element name="mileage" type="xs:string"/>
                        </xs:sequence>
                        <xs:attribute name="id" type="xs:string" use="required"/>
                    </xs:complexType>
                </xs:element>
            </xs:sequence>
        </xs:complexType>
    </xs:element>
</xs:schema>
